{
  "$schema": "https://json-schema.org/draft/2020-12/schema",
  "$id": "https://masi-nids.example/contracts/evidence/plugin-runtime-host-module/v1/schema.json",
  "type": "object",
  "additionalProperties": false,
  "required": [
    "schema_version", "module_id", "level", "applicability", "qualification",
    "generated_at", "source_revision", "source_tree_digest", "working_tree_dirty",
    "working_tree_status_digest", "executed_gates", "completion", "findings",
    "blackbox_e2e", "fault_recovery", "wasm_faults", "deep_checks", "performance", "oci", "supply_chain",
    "formal_soak", "traceability", "conditional_applicability", "requirement_ids",
    "artifact_digests", "qualification_gates", "remaining_holds", "overall_module_complete"
  ],
  "properties": {
    "schema_version": {"const": "plugin-runtime-host-module-gates/v1"},
    "module_id": {"const": "MOD-PLUGIN-001"},
    "level": {"const": "MODULE"},
    "applicability": {"const": "APPLICABLE"},
    "qualification": {"const": "NOT_QUALIFIED"},
    "generated_at": {"type": "string", "format": "date-time"},
    "source_revision": {"type": "string", "pattern": "^[0-9a-f]{40,64}$"},
    "source_tree_digest": {"$ref": "#/$defs/digest"},
    "working_tree_dirty": {"type": "boolean"},
    "working_tree_status_digest": {"$ref": "#/$defs/digest"},
    "executed_gates": {
      "type": "object",
      "minProperties": 15,
      "maxProperties": 24,
      "additionalProperties": {"const": "PASS"}
    },
    "completion": {
      "type": "object",
      "additionalProperties": false,
      "required": [
        "formal_soak_executed", "no_required_not_run", "open_p0_zero",
        "operational_gates_pass", "real_runtime_started"
      ],
      "properties": {
        "formal_soak_executed": {"const": true},
        "no_required_not_run": {"const": true},
        "open_p0_zero": {"const": true},
        "operational_gates_pass": {"const": true},
        "real_runtime_started": {"const": true}
      }
    },
    "findings": {
      "type": "object",
      "additionalProperties": false,
      "required": ["open_total", "open_p0"],
      "properties": {
        "open_total": {"const": 0},
        "open_p0": {"const": 0}
      }
    },
    "blackbox_e2e": {"$ref": "#/$defs/evidenceRef"},
    "fault_recovery": {"$ref": "#/$defs/evidenceRef"},
    "wasm_faults": {"$ref": "#/$defs/evidenceRef"},
    "deep_checks": {"$ref": "#/$defs/evidenceRef"},
    "performance": {"$ref": "#/$defs/evidenceRef"},
    "oci": {"$ref": "#/$defs/evidenceRef"},
    "supply_chain": {"$ref": "#/$defs/evidenceRef"},
    "formal_soak": {"$ref": "#/$defs/evidenceRef"},
    "traceability": {"$ref": "#/$defs/evidenceRef"},
    "conditional_applicability": {
      "type": "array",
      "minItems": 6,
      "maxItems": 6,
      "uniqueItems": true,
      "items": {
        "type": "object",
        "additionalProperties": false,
        "required": ["profile", "applicability", "result", "stable_reason"],
        "properties": {
          "profile": {"type": "string", "pattern": "^[a-z][a-z0-9-]{1,63}/v[0-9]+$"},
          "applicability": {"const": "NOT_APPLICABLE"},
          "result": {"const": "NOT_RUN"},
          "stable_reason": {"type": "string", "pattern": "^[A-Z][A-Z0-9_]{3,63}$"}
        }
      }
    },
    "requirement_ids": {
      "type": "array", "minItems": 32, "maxItems": 64, "uniqueItems": true,
      "items": {"type": "string", "pattern": "^[A-Z][A-Z0-9-]{2,63}$"}
    },
    "artifact_digests": {
      "type": "object", "minProperties": 16, "maxProperties": 128,
      "additionalProperties": {"$ref": "#/$defs/digest"}
    },
    "qualification_gates": {
      "type": "object",
      "additionalProperties": false,
      "required": [
        "formal_soak_3600_seconds", "host_boundary_performance",
        "core_relative_degradation_pairwise", "protected_release_baseline",
        "production_ha_multi_failure_domain", "nine_module_global_gate"
      ],
      "properties": {
        "formal_soak_3600_seconds": {"const": "PASS"},
        "host_boundary_performance": {"const": "PASS"},
        "core_relative_degradation_pairwise": {"const": "HOLD"},
        "protected_release_baseline": {"const": "HOLD"},
        "production_ha_multi_failure_domain": {"const": "HOLD"},
        "nine_module_global_gate": {"const": "HOLD"}
      }
    },
    "remaining_holds": {
      "type": "array", "minItems": 3, "maxItems": 8, "uniqueItems": true,
      "items": {"type": "string", "minLength": 1, "maxLength": 512}
    },
    "overall_module_complete": {"const": true}
  },
  "$defs": {
    "digest": {"type": "string", "pattern": "^sha256:[0-9a-f]{64}$"},
    "evidenceRef": {
      "type": "object",
      "additionalProperties": false,
      "required": ["evidence", "digest", "result"],
      "properties": {
        "evidence": {"type": "string", "minLength": 1, "maxLength": 512},
        "digest": {"$ref": "#/$defs/digest"},
        "result": {"const": "PASS"}
      }
    }
  }
}
