{
  "applicability": "APPLICABLE",
  "artifact_digests": {
    "cargo_lock": "sha256:02e447e845c368fd8b9fa3b4068e2e93c17a6ee1fb41751e16fe1c3fc2c914fd",
    "command_clippy": "sha256:84e5b262caa124c4f4b437f20e57ecb40d04015326f08de4ac95cbda7732b786",
    "command_contract-schema": "sha256:5636a4d2e23ef3a44fcab49ad130ec259b3d4a0b001372402ec15af50069da78",
    "command_control-contract-consumer": "sha256:2d12b8b1df4ef83874e3bc775d8a19153f147c05c4a6a1cf200725a083fcc4bf",
    "command_control-statistics-adapter": "sha256:2ec2cafa83bc78db583c3d63a494c33a27b2f022599a0e52d0dd6020ad10604e",
    "command_deep-checks": "sha256:dc264fc6e29e8cbdc81432ad64656c6fc6654c42708353e31bf3b3a7eb176752",
    "command_evidence-integrity": "sha256:3a846c22b7ef72afd38c097e4bd38fe8592022ccafb3b515f00f9dd5e1416820",
    "command_findings": "sha256:28f5f1fad04161c10fe307c05733d10f192fdb2f9c85146bf99e32aa90e8457d",
    "command_formal-soak": "sha256:924a7a071a979e3025ff015d09619058f5ddc964aa80065ddab804a49c720c1c",
    "command_format": "sha256:1f00843cd9f7909673cc33f24e8b5bcb1d58d205fcd96d8fe6be5de3f8277b87",
    "command_oci-smoke": "sha256:105c63006282f1bd8ba646b4ec45c9efc349e3f94e4a84d5e636cb32db4b6b10",
    "command_performance": "sha256:dd8d3ff786470bb723bd6b63f31648fd894f0e5cebb4f9df06be12146eaad313",
    "command_release-blackbox": "sha256:2da6ec7a869d2f6ce41662d088345314650ed67363c30287cfb0c62c434242d1",
    "command_release-build": "sha256:9b7cc33e371aba5088bedfa20b299d068abd1d2bdb694a0f9177cd23d405c83a",
    "command_rustdoc": "sha256:cbdac2736fdd5980d41f5a3dfbcad801aaf70985a2cab7515a1a7f1a4224789c",
    "command_source-sentinels": "sha256:7a0e7f002c9b4d8d55f7950a1608043bd18fca10b875e04589472a3c32bce802",
    "command_supply-chain": "sha256:bff4798794ad582ea3e10a246dd372dd9d012e6c90763cc075bbc51776b02633",
    "command_traceability": "sha256:d948677ba3130d7c9dc6b4e4d917f6f855f8c9b08612a9f3614c5800c8e8ddda",
    "command_unit-property-contract": "sha256:47e767fdf96c410f18eba1ad0e3306bba3e4874fe48d8fb412436c7c47cb62e0",
    "command_wasm-fault-matrix": "sha256:5f1845d5d0e390b5518f7b5bd3761297f22fabb2281c7a0b61f68a650cc08617",
    "control_contract_consumer": "sha256:17079b1e1fb41fd772fb5847f401cf40f59862a8cbc615bce4064f7e7920e975",
    "deep_checks_evidence": "sha256:6042f37027a7b17df02a24819f6909ca62270ba7f0945458dcc98057eee85340",
    "fault_recovery_evidence": "sha256:afd95fd594f29de4820d974c12847c8c9a8709f3ca5745aab9abb1c735166937",
    "formal_soak_evidence": "sha256:d8e1c41061d75637c25a26cd562bad73fe54a1e55cc43be66d2e4ba9ea00b81d",
    "host_binary": "sha256:7148a599113691c642dfee11cca4b45881a951881d3f0a7e1856977cc1aecc2d",
    "host_proto": "sha256:a6261fb506c523d0265134057b66caf9b1193387289afc4996857576cd20e80b",
    "hostctl_binary": "sha256:235f4fd280182039eddbee80c28cea70a04342013313669d3b87b62c3ebb46cf",
    "log_clippy": "sha256:a16685927daa0790a2b357e2b56df170e7bad259186d3c802d6d441422dfd0cf",
    "log_contract-schema": "sha256:d59a963e7552685e291c89fa6e9dfc1c08ce3b272ff036b713c363657b98ec29",
    "log_control-contract-consumer": "sha256:ce504c681f9d90ace87cbdc69af9c8742466f48f72603d35831cad110dec5f40",
    "log_control-statistics-adapter": "sha256:5ca513805d9e985148d9d9a662c23cb2592bde7783700da473cc1bc39150091b",
    "log_deep-checks": "sha256:6f10ef1d898043dbb70b2ba3763de4c262d54b5350ae3f0b182ee6908f4265e5",
    "log_evidence-integrity": "sha256:610305916214fd5642cbba399cef4ead1b195ad4ef0f49d4b459e67229f87143",
    "log_findings": "sha256:f8e6327f605486763bfc52156b77bb4e967cb50d91a552151709b7eff3d6fa9f",
    "log_formal-soak": "sha256:1c7ba9bb14fe7cfb99808e35b76cfe6d70d636bccc7c1e0cbde06036a45850c9",
    "log_format": "sha256:e3b0c44298fc1c149afbf4c8996fb92427ae41e4649b934ca495991b7852b855",
    "log_oci-smoke": "sha256:184810030660c013ba2e0de3a5450c5f398ddbf9b96ff7172a5d14a51a6c2696",
    "log_performance": "sha256:ed1cddb76f6181618d29eaa4f2b90ed899127b6201dcfbcc7deaeadbada071a6",
    "log_release-blackbox": "sha256:9b9ab691bb71b308b8c37cd0441e631e88ffd0d1397ecbee3be22dc338449e91",
    "log_release-build": "sha256:765f1396d07f30f3a451cd3f9d9cad4e83c92c8e0aecf955ffc09061a6cf1e02",
    "log_rustdoc": "sha256:9e484b4031d2eaf8ee67418ae395ba704103cd0daaf183f2d7cde00ecc985a92",
    "log_source-sentinels": "sha256:45e0ba22d78f3354778483816315c0bc8c58412f60675423626d7dd53be77e12",
    "log_supply-chain": "sha256:5b42332d885746dcb9a0897e27315a85ec2505899367d2273a7d87105533e99a",
    "log_traceability": "sha256:dd7170a449a69c7d87609e5b20da7d5d7b5ada8f7398d3ac50325cd9e7b69f78",
    "log_unit-property-contract": "sha256:604c845bb72d83f10744fa072773ab3621223184c306f0779110bbeac16e4d79",
    "log_wasm-fault-matrix": "sha256:ec13ad86dc5a2deb3847a84dadc354d1ab8b214358a06896982f49780f2c0a84",
    "module_findings": "sha256:609a3b87418a1aed0378264e7492b253c7530bb829fe8ae006b34ef70d340f8d",
    "oci_evidence": "sha256:e14e07f59d2f80e2e0b6c96ccd054bed5006bbf7f33b161955da2feeba1c9127",
    "performance_evidence": "sha256:0b1433704b4e267972fdf81dd555ce31d8774548eb84e332d29e054db514d963",
    "requirements_baseline": "sha256:89007ff7623741da78940df9019fd30acc97deb2ea4c21807f404f6418ae7268",
    "requirements_traceability_manifest": "sha256:554215868ba8f3d4faaadbeaab3319a780e9d5541c7693295c789e41f3f058f4",
    "service_fixture_binary": "sha256:43ab7bdabccf8403efc8725d0716516569e61ea09b52143c80ff95453c9585c9",
    "service_proto": "sha256:d64a04a8d9c1f0e0d58d4259f5c8c1342aec640ec31699e5f05ace7c50f6bf3e",
    "supply_chain_evidence": "sha256:4f67d3a122f1a6073c32e549077ce57ced757a943b69cbbf4fbdb0556689c535",
    "traceability_evidence": "sha256:75bd4d3b48d35f1119b22aa8f15d4b6e5c095881422cf1bf956095a05053b025",
    "wit_source": "sha256:43e8eac37b165c4cfd84280cfe0e17cd6ca203abb2aa55b41c921890cef0567b"
  },
  "blackbox_e2e": {
    "digest": "sha256:9b9ab691bb71b308b8c37cd0441e631e88ffd0d1397ecbee3be22dc338449e91",
    "evidence": "release-blackbox.log",
    "result": "PASS"
  },
  "completion": {
    "formal_soak_executed": true,
    "no_required_not_run": true,
    "open_p0_zero": true,
    "operational_gates_pass": true,
    "real_runtime_started": true
  },
  "conditional_applicability": [
    {
      "applicability": "NOT_APPLICABLE",
      "profile": "analysis-agent-host-proxy/v1",
      "result": "NOT_RUN",
      "stable_reason": "DIRECT_TYPED_ADAPTER_REQUIRED"
    },
    {
      "applicability": "NOT_APPLICABLE",
      "profile": "wasi-0-3/v1",
      "result": "NOT_RUN",
      "stable_reason": "WASI_0_2_FIRST_RELEASE_PROFILE"
    },
    {
      "applicability": "NOT_APPLICABLE",
      "profile": "cross-host-service-mtls/v1",
      "result": "NOT_RUN",
      "stable_reason": "SAME_HOST_UDS_ACCEPTANCE_PROFILE"
    },
    {
      "applicability": "NOT_APPLICABLE",
      "profile": "production-ha/v1",
      "result": "NOT_RUN",
      "stable_reason": "SINGLE_FAILURE_DOMAIN_HOST"
    },
    {
      "applicability": "NOT_APPLICABLE",
      "profile": "external-source-readonly/v1",
      "result": "NOT_RUN",
      "stable_reason": "PURE_TRANSFORM_CONFORMANCE_BINDING"
    },
    {
      "applicability": "NOT_APPLICABLE",
      "profile": "effectful-plugin/v1",
      "result": "NOT_RUN",
      "stable_reason": "FIRST_RELEASE_KINDS_HAVE_NO_EFFECTS"
    }
  ],
  "deep_checks": {
    "digest": "sha256:6042f37027a7b17df02a24819f6909ca62270ba7f0945458dcc98057eee85340",
    "evidence": "deep/deep-checks-evidence.json",
    "result": "PASS"
  },
  "executed_gates": {
    "clippy": "PASS",
    "contract-schema": "PASS",
    "control-contract-consumer": "PASS",
    "control-statistics-adapter": "PASS",
    "deep-checks": "PASS",
    "evidence-integrity": "PASS",
    "findings": "PASS",
    "formal-soak": "PASS",
    "format": "PASS",
    "oci-smoke": "PASS",
    "performance": "PASS",
    "release-blackbox": "PASS",
    "release-build": "PASS",
    "rustdoc": "PASS",
    "source-sentinels": "PASS",
    "supply-chain": "PASS",
    "traceability": "PASS",
    "unit-property-contract": "PASS",
    "wasm-fault-matrix": "PASS"
  },
  "fault_recovery": {
    "digest": "sha256:afd95fd594f29de4820d974c12847c8c9a8709f3ca5745aab9abb1c735166937",
    "evidence": "fault/fault-evidence.json",
    "result": "PASS"
  },
  "findings": {
    "open_p0": 0,
    "open_total": 0
  },
  "formal_soak": {
    "digest": "sha256:d8e1c41061d75637c25a26cd562bad73fe54a1e55cc43be66d2e4ba9ea00b81d",
    "evidence": "formal-soak/soak-evidence.json",
    "result": "PASS"
  },
  "generated_at": "2026-08-25T22:14:13.975814Z",
  "level": "MODULE",
  "module_id": "MOD-PLUGIN-001",
  "oci": {
    "digest": "sha256:e14e07f59d2f80e2e0b6c96ccd054bed5006bbf7f33b161955da2feeba1c9127",
    "evidence": "oci/oci-smoke-evidence.json",
    "result": "PASS"
  },
  "overall_module_complete": true,
  "performance": {
    "digest": "sha256:0b1433704b4e267972fdf81dd555ce31d8774548eb84e332d29e054db514d963",
    "evidence": "performance/performance-evidence.json",
    "result": "PASS"
  },
  "qualification": "NOT_QUALIFIED",
  "qualification_gates": {
    "core_relative_degradation_pairwise": "HOLD",
    "formal_soak_3600_seconds": "PASS",
    "host_boundary_performance": "PASS",
    "nine_module_global_gate": "HOLD",
    "production_ha_multi_failure_domain": "HOLD",
    "protected_release_baseline": "HOLD"
  },
  "remaining_holds": [
    "Formal Go Plugin Manager and PostgreSQL pairwise integration has not started because the nine-module gate remains HOLD.",
    "The current Go statistics producer has not yet been pairwise-qualified against the expanded strict Host input bundle; only public schema and adapter compilation are checked in this module run.",
    "Relative core p99/RSS degradation requires the later Plugin Platform and core peak-load qualification scope.",
    "The acceptance host is one failure domain and cannot claim production-ha qualification.",
    "A protected release commit/tag and its release-baseline digest are not established by this working-tree module run.",